{
  "receipt_name": "Synthetic project brief review receipt",
  "work_context": "A small operations team receives a polished AI-assisted project brief before deciding whether it is safe to forward to a partner.",
  "review_owner": "Operations lead",
  "review_date": "2026-07-06",
  "artifact": {
    "title": "Q3 community workshop expansion brief",
    "source": "AI-assisted draft from team notes and public website copy",
    "status_before_review": "drafted",
    "ai_assistance_disclosed": true
  },
  "intended_use": "Internal planning only; not partner-facing until unsupported claims and ownership questions are resolved.",
  "review_checks": [
    {
      "check": "Named numbers traced to source",
      "result": "needs_work",
      "evidence": "Attendance estimate appears in the draft but no source note or prior registration report is attached."
    },
    {
      "check": "Responsible owner named",
      "result": "needs_work",
      "evidence": "Draft says 'the team will follow up' without naming the person who owns partner contact."
    },
    {
      "check": "Sensitive data absent",
      "result": "passed",
      "evidence": "No client names, private records, financial account data, or health/legal details are included."
    },
    {
      "check": "Decision-ready summary separated from speculation",
      "result": "needs_work",
      "evidence": "Two confident recommendations rely on unverified demand assumptions."
    }
  ],
  "known_weak_spots": [
    "Unsupported attendance estimate",
    "No owner for partner follow-up",
    "No note about what changed from the original notes"
  ],
  "human_edits": [
    "Changed 'will increase turnout' to 'may increase turnout if partner demand is confirmed'",
    "Added owner placeholder and source-needed marker"
  ],
  "confidence_after_review": "medium",
  "next_reviewer": "Project owner before partner sharing",
  "do_not_claim": [
    "This receipt does not prove the brief is accurate",
    "This is not an AI detector or worker discipline tool",
    "Do not treat polished formatting as review evidence"
  ],
  "boundary_note": "Local review hygiene aid only. It is not legal, HR, compliance, quality-certification, or performance-management advice. Use it to reduce downstream burden, not to blame the person who drafted the work."
}
